vacancy_id,vacancy_name,company_name,address,latitude,longitude,salary_from,salary_to,salary_currency,salary_gross,publication_time,last_changed,schedule,req,resp,cond
72543609,Аналитик данных,Сбер. IT,,,,,,,,2022-11-18 11:30:32,2022-11-27 07:01:20,FULL_DAY,"Работа с данными. Навыки: Базовое понимание принципов работы Баз Данных. Высшее образование по профилю (математическое, экономическое, техническое). Понимание стандартных алгоритмов. ","Участника команды в проект «Единый источник данных Казначейства», который бы помог нам с ежедневным мониторингом процессов поставки данных в команде...",
71343651,Аналитик данных,СОГАЗ: г. Москва,"Москва, Уланский переулок, 26",55.769955,37.641755,,,,,2022-11-18 14:09:36,2022-11-18 14:09:36,FULL_DAY,Опыт работы с BI-платформами (QlikView). Опыт настройки API-интеграций. Понимание архитектуры корпоративных хранилищ данных. Желателен опыт внедрения маркетинговой аналитики. ,...коммуникаций из баз данных. Настройка автоматических выгрузок. Мониторинг и анализ клиентской базы. Построение витрин данных. Настройка обмена данных по API. ,"Опыт в компании 1 в России на рынке корпоративного страхования, в высокопрофессиональной команде с уникальной для рынка историей, знаниями и..."
72474440,Аналитик обработки данных,Ритейл Эксперт,"Москва, 17-й проезд Марьиной Рощи, 4к1",55.809171,37.611976,,90000.0,RUR,False,2022-11-17 11:43:00,2022-11-17 13:03:44,FULL_DAY,"Высшее профильное образование (техническое, математическое). Опыт работы с массивом данных, Excel/Access макросы VBA (обязательно), SQL (как преимущество*) выгрузки. ","...подразделениями на предмет обсуждения данных, отраженных в отчетах и осуществление корректирующих мер. Технический анализ и интерпретация данных коммерческой отчетности – товарооборот...",Комфортный офис возле м. Бутырская. Работа в одном из лидеров своего сегмента. График работы 5/2 с 09.00 до...
72531059,Аналитик данных в команду платформы АБ-тестирования,Сбер для экспертов,,,,,,,,2022-11-18 09:19:14,2022-11-27 07:01:20,FULL_DAY,...продуктового аналитика - опыт проведения АБ-тестов. Знание SQL на хорошем уровне (опыт работы с Hive будет плюсом). Опыт анализа данных...,Помогать продуктовым командам с проведением экспериментов: от идеи и дизайна эксперимента до интерпретации результатов. Помогать с нестандартными расчетами - поддерживать и...,Официальное трудоустройство согласно ТК РФ. Заработная плата (оклад + годовая премия). Возможность обучения за счет компании. Страхование (от несчастных случаев...
70020940,Middle/Senior аналитика данных,К-ТЕХНОЛОГИИ,"Москва, Электрозаводская улица, 27с8",55.791582,37.705607,,,,,2022-11-25 12:41:28,2022-11-25 12:41:28,FULL_DAY,"Опыт разработки требований для UX/UI, прототипирования интерфейсов. Опыт разработки и тестирования ПО. Понимание архитектуры хранилищ данных. Опыт работы с...","Выявление, формализация требований. Формирование бэклога, согласование с командой разработки. Предложение и тестирование гипотез, разработка и формализация пользовательских сценариев. ","...и архитектурные встречи по обмену опытом; формируем персональный план развития аналитика. Следование современным трендам: Gitlab, настроенный CI/CD, набор инструментов..."
72531692,Аналитик данных SQL (middle),«РОСБАНК»,,,,,,,,2022-11-18 09:27:24,2022-11-21 08:40:30,REMOTE,"Знакомство с Hadoop, Spark, Hive, HBase (приветствуется). Опыт работы аналитиком или разработчиком в Data. Будет преимуществом опыт работы с данными...","...витрин данных, анализ данных и устранение возникающих проблем. Обеспечение доступности данных для анализа и их корректная передача между командами аналитики. ",Полностью дистанционный формат работы – это возможность работать из любой точки РФ. Стабильный и прозрачный доход: зарплата и премии по результатам...
72335867,Аналитик данных,ТехноГрупп,"Дзержинский, улица Энергетиков, 1",55.638953,37.834048,,110000.0,RUR,False,2022-11-15 06:22:06,2022-11-16 05:46:00,FULL_DAY,"Личностные качества: Аналитический склад ума, внимательность, ответственность, конструктивность. Умение работать с большими объемами данных. Коммуникабельность. Владение базовыми знаниями мат.статистики и...","Количество сотрудников: 1. Непосредственный руководитель: Руководитель отдела аналитики. Сбор, обработка и анализ больших объемов данных в Excel. Анализ трендов, прогнозирование. ",ЗП на испытательный срок: От 110 000. Дополнительные выплаты: KPI. Режим работы: 09.00-18.00.
72083236,Аналитик данных,ГБУ Кадровый центр ДЗМ,,,,,,,,2022-11-17 12:46:45,2022-11-18 07:44:37,FULL_DAY,Опыт работы аналитиком данных / системным аналитиком. Уверенное знание SQL. Понимание принципов работы реляционных баз данных и ETL-процессов. ,"Разработка витрин данных (ClickHouse, PostgreSQL). Проектирование процессов преобразования данных (ETL) для хранилища данных (Airflow, Python). Автоматизация отчетности. Ad-hoc аналитика.",Оформление по ТК РФ. Офис в шаговой доступности от м. Новослободская. Заработная плата обсуждается с успешным кандидатом. Профессиональный и карьерный...
72405936,Аналитик баз данных,ФармаСофт,"Москва, Люблинская улица, 42",55.685107,37.736375,,,,,2022-11-16 09:36:00,2022-11-23 15:54:56,FULL_DAY,"...сводные таблицы обязательно в полном объеме, построение дашбордов, импорт/экспорт данных из любых источников, знание VBA). - как плюс, владение средствами...","получение и обработка данных из различных источников. - построение отчетов, дашбордов, аналитических систем. - проведение анализа данных, выявление закономерностей. - интеграция различных систем...",трудоустройство в соответствии с ТК РФ. - работа в офисе: ул. Люблинская 42. - график работы 5/2 09.00 – 18.00...
72402526,Аналитик данных,Сбер. IT,,,,,,,,2022-11-16 08:41:08,2022-11-27 07:01:20,FULL_DAY,"...бизнес аналитика в IT-компании/Финансовой сфере. Опыт проведения обследований, сбора, формализации и анализа требований для разработки трактов данных. ","...с поставкой и распространением данных. Консультировать разработчиков, тестировщиков, заказчиков по вопросам, возникающим в процессе разработки, тестирования и эксплуатации трактов данных.",Стабильный оклад и социальная поддержка сотрудников. Расширенный ДМС с первого дня работы для сотрудников и льготная медицинская страховка для близких. 
72436370,Аналитик данных (е-commerce направление),Комус,"Москва, проезд Завода Серп и Молот, 10",55.752587,37.702355,,,,,2022-11-16 20:34:06,2022-11-23 11:44:24,FULL_DAY,"Уверенный SQL. Желателен опыт использования Python при анализе данных. Если есть опыт работы с веб-аналитическими системами (ЯМ, GA и...","Поддержка аналитикой продуктовых и бизнес команд. Проведение аналитических исследований, составление справок и презентаций. Настройка веб-разметки и систем аналитики GA...","Оформление по ТК РФ. Стабильные выплаты заработной платы и премии. Большой современный офис рядом с метро Авиамоторная, БЦ ""Интеграл"". "
71824954,Системный аналитик/Аналитик данных Big Data (middle),Лига Цифровой Экономики,,,,,,,,2022-11-17 16:00:56,2022-11-24 06:49:58,FULL_DAY,"SQL, понимание логики построения слоёв хранилища, навыки работы с impala, Hadoop, хорошее знание сводных таблиц Excel, навыки работы с Oracle. ",...реплицирование через Spark Loader. Для нескольких сотрудников на проекте есть задачи по визуализации данных в tableau или через Power Pivot.,Работа в офисе (м. Полянка).
68217245,Аналитик данных (Tableau),"Компания «СПОРТМАСТЕР», Sportmaster Lab",,,,,,,,2022-11-16 12:34:10,2022-11-27 07:01:21,FULL_DAY,"Понимание процессов ETL. Уверенное владении SQL (фильтрации, подзапросы, агрегация). Опыт работы с Tableau от 2-х лет (понимание и использование...","Контроль и обеспечение корректности данных для конечных пользователей отчетов. Оптимизация и улучшение имеющихся процессов, связанных с разработкой BI-аналитики. ",
72402149,"Аналитик данных (Middle, Content)",Okko,"Москва, Рочдельская улица, 15с13",55.755991,37.56512,,,,,2022-11-16 08:36:36,2022-11-21 08:39:21,FULL_DAY,Профильное образование (Прикладная математика / Информатика / Статистика) или релевантный опыт работы. Хорошее знание математической статистики. Умение читать и писать код на...,"...данных. Работа над улучшениями и анализ ключевых контентных метрик, таких как конверсия в просмотр, досматриваемость, время в сервисе. Подготовка данных...","Работа в сильной команде, состоящей из топовых аналитиков, аналитиков-разработчиков и инженеров. Топовое оборудование и весь необходимый софт. Официальное трудоустройство. "
72457596,Аналитик данных в ИТ/ Data Steward,СберЛизинг,"Москва, Поклонная улица, 3",55.736174,37.533185,,,,,2022-11-17 08:07:10,2022-11-17 08:07:10,FULL_DAY,"...данных, по организации запуска системы и передачи в промышленную эксплуатацию. Понимание теории баз данных. Знание принципов хранения и обработки данных. ","...и использования данных. Обеспечение целостности данных. Определение источников данных и степени доверия к ним. Обеспечение качества корпоративных данных (собранных, хранящихся...",Конкурентный доход (оклад и годовой бонус). Красивый современный офис рядом с м. Кутузовская или удалённая работа. 3 персональных дня в...
72028680,"Аналитик качества данных, Data Governance","билайн: ИТ, Data, Digital",,,,,,,,2022-11-25 13:32:57,2022-11-25 14:19:34,FULL_DAY,"Понимание принципов построения СУБД и хранилищ данных. Самообучаемость, желание развиваться в этой сфере. Будет плюсом: Знание BI-инструментов ( Qlick View ). ","Разработка единой методологии создания технических и бизнес проверок качества данных. Участие во внедрении процессов анализа, мониторинга и управления качеством данных...",
71221332,Аналитик данных / продукта (RecSys),"Компания «СПОРТМАСТЕР», Sportmaster Lab",,,,,,,,2022-11-15 09:57:50,2022-11-27 07:01:21,REMOTE,Уверенное владение Python (в части анализа данных). Опыт проведения AB-тестов. Знание базовых алгоритмов ML и опыт работы в agile...,"Проектировать продуктовые и технические метрики продукта, создавать дэшборды для их отслеживания. Анализировать влияние доработок алгоритмов рекомендаций на технические метрики, искать...",
71504560,Аналитик данных,Центр Методического Обеспечения Оптимизации Процессов Государственного Управления в Московской области,,,,,,,,2022-11-17 06:59:06,2022-11-22 11:35:11,FULL_DAY,"Свободное владение SQL, включая написание функций. Опыт формирования витрин данных, отчётности. Опыт работы с BI платформами. Опыт программирования, базовые знания...","Анализ источников данных для формирования витрин. Написание SQL-запросов, функций для формирования данных. Выстраивание потоков данных.","Возможность работать в технологической компании, создающей сервисы и системы полезные людям. Культура открытости и взаимопомощи — мы небезразличны к тому, над..."
67690935,Middle/Senior аналитик данных (BI),К-ТЕХНОЛОГИИ,"Москва, Электрозаводская улица, 27с8",55.791582,37.705607,,,,,2022-11-25 12:41:29,2022-11-25 12:41:29,FULL_DAY,"Опыт разработки и тестирования ПО, умение читать программный код (желательно). Понимание архитектуры хранилищ данных. Опыт работы с ведущими СУБД (PostgreSQL...","...данных в хранилище: подключение и настройка источников, нормализация и трансформация данных, настройка загрузки данных. Формирование спецификации на разработку витрин данных...","...и архитектурные встречи по обмену опытом; формируем персональный план развития аналитика. Следование современным трендам: Gitlab, настроенный CI/CD, набор инструментов..."
71204490,Аналитик данных,Россельхозбанк,,,,,140000.0,RUR,True,2022-11-14 07:04:13,2022-11-17 10:07:01,FULL_DAY,"Средне профессиональное/ неоконченное высшее/ высшее образование. Опыт работы в сфере аналитики. Знание Excel (функции, сводные таблицы, форматирование, построение графиков), SQL...","Развитие и поддержка хранилища на базе SQL Server (наполнение базы данных информацией из разных источников с очисткой и предобработкой, используя...",Уровень заработной платы определяется по итогам собеседования (оклад.часть + ежеквартальные премии). График работы: 5/2 (выходные - суббота и воскресенье). 
71840083,Аналитик данных (Казначейство),Газпромбанк,,,,,,,,2022-11-17 11:34:26,2022-11-22 07:35:46,FULL_DAY,"...чтения плана выполнения, опыт работы от 3 лет. Знание Python или .NET C# приветствуется. Опыт самостоятельного сбора и анализа данных.","Аналитика и проверка качества данных, используемых в процессах казначейства Банка. Осуществление тестирования на платформе MS SQL. Техническое сопровождение существующих модулей...",
71385303,Архитектор моделей данных (Лидер группы аналитиков),"ЗЕНИТ, банк","Москва, Одесская улица, 2",55.664182,37.598663,,,,,2022-11-17 12:33:28,2022-11-24 08:16:22,FULL_DAY,"Хорошее знание SQL, Excel. Желательно - начальные знания в python. Знание архитектуры моделей данных обязательно.",...аналитике. Изучение внутренних и внешних источников данных. Лидирование группы бизнес-аналитиков. Перенос обобщения потребностей бизнеса в архитектуру данных (модели данных).,Работа в динамично развивающемся Банке ТОП-40. Оформление согласно трудового законодательства РФ. ДМС после исп. срока. Стабильная заработная плата. 
72314401,Аналитик баз данных/ BI аналитик,Bayer,"Москва, 3-я Рыбинская ул.",55.79014,37.661473,,,,,2022-11-14 13:18:09,2022-11-14 13:18:09,FULL_DAY,"...анализа данных; понимание принципа построения аналитических систем и систем формирования отчетности; понимание процессов оценки качества, очистки и преобразования данных (ETL...","Анализирует существующие решения по автоматизации отчетности, инициирует и контролирует разработку новых математических моделей и алгоритмов для оптимизации ресурсов. ","Работу в стабильной международной компании. Стабильную заработную плату. Компенсацию питания. 5 недель оплачиваемого отпуска. ДМС, страхование жизни и страхование от..."
72309166,Аналитик данных (Advanced Analytics),Сбер для экспертов,,,,,,,,2022-11-14 11:58:22,2022-11-27 07:01:20,FULL_DAY,"Опыт в аналитике данных (несколько из): оптимизация процессов, сегментация, когортный анализ, оптимальные коммуникации, речевая аналитика. Навыки, необходимые для выполнения описанных...","Проведение тестирования гипотез, визуализация план-факторного анализа, расчет ключевых метрик, маркировка отклонений. Визуализация данных и подготовка презентаций для защиты результатов...","Полный рабочий день, но гибкий график работы (можно выбрать режим начала работы в промежутке 7:00 - 10:30). "
72375543,Аналитик данных по страховому рынку (Excel),Центральный банк Российской Федерации,"Москва, Мосфильмовская улица, 8к2",55.724454,37.526124,,,,,2022-11-15 15:58:27,2022-11-25 13:49:20,FULL_DAY,"Профессиональные знания в области сбора, обработки и анализа больших массивов данных. Опыт работы в крупных страховых организациях, банках, аудиторских или...","Сбор, обработка и анализ больших массивов данных по страховому рынку и формирование выводов в рамках подготовки аналитических отчетов и информации...",Обсуждаются индивидуально.
72430037,"Бизнес аналитик (Управление данными, офис CDO, качество данных)",ДОМ.РФ,"Москва, Ленинградский проспект, 35с1",55.789461,37.551735,,,,,2022-11-16 15:11:33,2022-11-21 10:59:42,REMOTE,Опыт участия в процессах управления качеством данных. Понимание принципов построения DWH (хранилищ данных). Опыт работы со специализированным программным обеспечением по...,"...данных. Формализацией требований к качеству данных, применяемых для ПВР (выполнение требований Положения ЦБ РФ 483-п). Внедрением проверок качества данных...",Конкурентный уровень заработной платы и регулярные премии. Гибридный/удалённый формат работы. Комфортный офис в Москве на ст. м. 
