vacancy_id,vacancy_name,company_name,company_dept,area,address,latitude,longitude,salary_from,salary_to,salary_currency,salary_gross,publication_time,last_changed,schedule,req,resp,cond,skills
72309166,Аналитик данных (Advanced Analytics),Сбер для экспертов,Сбер для экспертов,1,,,,,,,,2022-11-14 11:58:22,2022-11-27 07:01:20,FULL_DAY,"Опыт в аналитике данных (несколько из): оптимизация процессов, сегментация, когортный анализ, оптимальные коммуникации, речевая аналитика. Навыки, необходимые для выполнения описанных...","Проведение тестирования гипотез, визуализация план-факторного анализа, расчет ключевых метрик, маркировка отклонений. Визуализация данных и подготовка презентаций для защиты результатов...","Полный рабочий день, но гибкий график работы (можно выбрать режим начала работы в промежутке 7:00 - 10:30). ",
72375543,Аналитик данных по страховому рынку (Excel),Центральный банк Российской Федерации,,1,"Москва, Мосфильмовская улица, 8к2",55.724454,37.526124,,,,,2022-11-15 15:58:27,2022-11-25 13:49:20,FULL_DAY,"Профессиональные знания в области сбора, обработки и анализа больших массивов данных. Опыт работы в крупных страховых организациях, банках, аудиторских или...","Сбор, обработка и анализ больших массивов данных по страховому рынку и формирование выводов в рамках подготовки аналитических отчетов и информации...",Обсуждаются индивидуально.,
72430037,"Бизнес аналитик (Управление данными, офис CDO, качество данных)",ДОМ.РФ,,1,"Москва, Ленинградский проспект, 35с1",55.789461,37.551735,,,,,2022-11-16 15:11:33,2022-11-21 10:59:42,REMOTE,Опыт участия в процессах управления качеством данных. Понимание принципов построения DWH (хранилищ данных). Опыт работы со специализированным программным обеспечением по...,"...данных. Формализацией требований к качеству данных, применяемых для ПВР (выполнение требований Положения ЦБ РФ 483-п). Внедрением проверок качества данных...",Конкурентный уровень заработной платы и регулярные премии. Гибридный/удалённый формат работы. Комфортный офис в Москве на ст. м. ,
72492020,Data Analyst / Аналитик данных,КБ Стрелка,,1,"Москва, Берсеневский переулок, 2с1",55.740999,37.609613,100000.0,120000.0,RUR,False,2022-11-17 18:29:34,2022-11-18 13:51:32,FULL_DAY,"Высшее образование (IT, прикладная математика, информатика и т. д.). Релевантный опыт работы от 3 лет.",Построение и проверка гипотез на основе данных. Создание скриптов валидации данных. Построение схем хранения данных. Визуализация данных и их агрегатов. ,"Полная занятость, возможен удаленный режим работы. Испытательный срок – 3 месяца. ДМС после испытательного срока. Красивый офис на Красном Октябре.",
72336364,Аналитик данных отдела бизнес-технологий,STROTSKIS GROUP,,1,,,,,,,,2022-11-15 06:28:18,2022-11-21 09:13:04,FULL_DAY,Опыт работы от 2 лет в аналитике данных торговой компании. Владение Excel на продвинутом уровне. 1С уверенный пользователь.,"Аналитика продаж и ассортимента в сегменте B2B. RFM, когортный анализ, ABC/XYZ, анализ клиентской базы / воронки продаж. ","Работа в офисе с ПН по ПТ в режиме рабочего дня на выбор: 9-18, 8-17.",
69820273,Аналитик данных / Data Analyst,Квиллис,,1,"Москва, Новодмитровская улица, 2к1",55.804941,37.589922,,,,,2022-11-13 14:39:01,2022-11-22 14:17:26,FULL_DAY,"Опыт работы (от 2 лет) системным аналитиком/аналитиком данных в команде разработки ПО. Умение выявлять, структурировать и документировать требования к...","Сбор, анализ и документирование требований. Анализ больших объемов данных, выявление выбросов. Построение AD HOC аналитики для быстрого принятия решений. ","Стать участником команды, создающей продукты и реализующей проекты. Работаем со своими продуктами и используем лучшее ПО в своём классе от...",
69026702,Аналитик данных Финансового департамента,МТС Банк. Головной офис,МТС Банк. Головной офис,1,"Москва, проспект Андропова, 18к1",55.695022,37.66274,,,,,2022-11-14 08:07:34,2022-11-14 08:07:34,FULL_DAY,"...MS Excel (знание BI система будет плюсом). Умение анализировать и систематизировать большой объем данных, выявлять ошибки, оперативно проводить трансформацию данных.","Разработка форм представления аналитики и отчетности (BI дашборды, презентации, Excel отчеты). Участие в развитии корпоративного хранилища данных со стороны финансов...",Достойная заработная плата. Отсутствие дресс-кода. Современный и уютный офис в 2х минутах от м. Технопарк. Корпоративное кафе «Мечта...,
71545541,Ведущий аналитик данных,Газпром-медиа Развлекательное телевидение (ГПМ РТВ),,1,,,,,,,,2022-11-18 11:55:26,2022-11-22 07:00:31,FULL_DAY,"Свободное владение Python для анализа данных и решения связанных с этим задач. Опыт визуализации данных, желательно навыки работы с BI...","Анализ новых источников данных продукта, проверка корректности сбора данных. Коммуникация с командой департамента (аналитики, DS, разработка, QA) и продуктовой командой...",Трудоустройство по ТК РФ. Удаленная работа с возможностью выхода в офис по желанию. ДМС (включая стоматологию) после испытательного срока. ,
72291596,Аналитик баз данных,МГТС,,1,"Москва, 1-я Дубровская улица",55.725919,37.670465,,,,,2022-11-14 08:03:23,2022-11-15 13:32:23,FULL_DAY,"Высшее образование. Знание языка запросов SQL, работа в SQL Management Studio, Oracle SQL Developer, MS ACCESS, EXCEL, Power BI, Microsoft...","Визуализация отчетности в power BI. Написание запросов SQL. Формирование отчётов, выгрузок из ИТ систем.","Оформление по ТК РФ. График 5/2 (ОФИС), м. Пролетарская. Расширенный пакет ДМС. Предоставляем служебную мобильную связь. Профессиональное обучение и...",
72323790,Аналитик (Анализ и консолидация данных управленческого учета),Группа компаний С7,,1,"Москва, улица Петровка, 7",55.762237,37.617069,,,,,2022-11-14 18:16:45,2022-11-15 08:59:35,FULL_DAY,"Инициативность, коммуникабельность, аналитический склад ума, внимательность, аккуратность, умение работать самостоятельно. Опыт работы экономистом / аналитиком – от 1 года. Знание Tableau, 1...",Участие в бюджетном процессе авиакомпании. Бюджетно-финансовый контроль дочерних организаций. Анализ и консолидация данных управленческого учета. Подготовка аналитических и презентационных...,Бессрочный трудовой договор. Пятидневный график работы в офисе. Испытательный срок 3 месяца. Профессиональное развитие (возможность работать над интересными и перспективными...,
71502317,Программист-аналитик данных телепроектов,Первый канал,,1,"Москва, улица Академика Королёва, 12",55.822883,37.606281,62000.0,,RUR,True,2022-11-14 07:51:01,2022-11-23 09:41:17,FULL_DAY,"...данных, телевизионная социология, математический анализ. Знания и навыки - уверенный пользователь Exсel, PowerPoint и 1С (работа с большими массивами данных...","Написание запросов с помощью языков программирования, разработка системы сравнения и анализа данных разных проектов, данных за большие периоды. ",Работа в ТТЦ Останкино. Испытательный срок 3 месяца. Оформление в соответствии с ТК РФ.,
72179862,"Аналитик данных Excel, SQL",ГКУ города Москвы Центр занятости населения города Москвы,,1,,,,120000.0,,RUR,True,2022-11-10 12:09:25,2022-11-25 14:00:59,FULL_DAY,Высшее образование/также готовы рассмотреть также студентов последних курсов (финансовое/экономическое/информационные технологии в том числе). Отличные знания MS Excel...,"Анализ информации (тренды, векторы, взаимозависимые факторы) и формирование аналитических записок и презентаций. Разработка отчетов и систем сквозной аналитики.",Работа с социально значимыми проектами г. Москвы. Молодая и энергичная команда профессионалов. Официальное трудоустройство и социальные гарантии. Фиксированный оклад +...,
71703471,Ведущий аналитик данных (SQL),М-Холдинг,,1,,,,,,,,2022-11-11 12:53:20,2022-11-23 16:00:43,FULL_DAY,"Опыт работы с различными источниками данных, в том числе с базами данных с использованием SQL, VВА, Excel. Математический склад ума. ","Анализ входных данных и подготовка на базе этих данных регулярных отчетов. Обработка разовых запросов для клиентов, входной контроль качества данных...","Работа в районе м. Парк Победы/ м. Багратионовская, шаговая доступность. Стабильная индексируемая заработная плата. Перспектива карьерного роста и профессионального развития. ",
72231657,Аналитик данных,Сбер для экспертов,Сбер для экспертов,1,,,,,,,,2022-11-11 13:09:40,2022-11-27 07:01:20,FULL_DAY,"Greenplum, Oracle. Python, R (при желании). Аналитический склад ума. Отличное знание математической статистики. Глубокое понимание методов математического моделирования. ","Статистический анализ портфеля кредитных карт. Совершенствование риск-стратегий новых выдач. Взаимодействие с командами моделирования, разработки, DWH и бизнес-подразделениями.",Интересные и амбициозные задачи с использованием современных технологий и актуальных подходов к разработке. Реальная возможность профессионального и карьерного роста в...,
69975800,Ведущий аналитик данных/Консультант (Корпоративно-инвестиционный бизнес ВТБ),ВТБ Капитал,,1,"Москва, Пресненская набережная, 12",55.749537,37.537398,,,,,2022-11-15 10:04:42,2022-11-25 07:02:54,FULL_DAY,"Высшее образование (приоритетно по специальностям экономика, финансы, прикладная математика). Опыт работы – не менее 3 лет в корпоративных финансах, банковской сфере...",Разработка методологии расчета рынка банковских продуктов с детализацией до клиента с использованием внешних и внутренних источников. Расчет рынка/постановка задачи...,"Трудоустройство согласно законодательству; конкурентная заработная плата. Профессиональное обучение и развитие. Добровольное медицинское страхование, льготные условия кредитования. Корпоративная пенсионная программа, материальная...",
68144682,Аналитик данных (внутренний аудит),Центральный банк Российской Федерации,,1,"Москва, Ленинский проспект, 1/2к1",55.727136,37.609901,,,,,2022-11-14 09:00:48,2022-11-25 13:49:20,FULL_DAY,"Опыт работы с большими объемами данных. Знание иностранных языков и уровень владения: английский (advanced). Личностные характеристики: аналитический склад ума, хорошие...","Анализ больших объемов данных: написание скриптов на SQL, Python при планировании и подготовке процедур внутреннего аудита в Банке России по...",Получение уникального опыта в мегарегуляторе. Возможности профессионального и карьерного развития. Привлекательная система мотивации. Широкий социальный пакет. Корпоративное обучение. ,
72310769,Консультант-аналитик/Системный аналитик/Аналитик данных (Владимир),Abi,,1,,,,,,,,2022-11-14 12:20:56,2022-11-17 08:45:44,FULL_DAY,"...хранилищ данных, построения и автоматизации отчетных моделей данных для бизнеса. Опыт работы в должности разработчика BI, разработчика хранилища данных. ","Организация ETL-процессов (извлечение, преобразование, загрузка массива данных), системы логирования и мониторинга корректности загрузки данных, проведение систематической проверки исходного кода...","Прозрачная система мотивации по системе KPI (оклад + ежеквартальная премия), совокупный доход обсуждается при собеседовании с успешными кандидатами. ",
71614468,Аналитик данных (департамент внутреннего аудита),Росгосстрах,,1,"Москва, Киевская улица, 7",55.742119,37.558957,,,,,2022-11-15 16:43:39,2022-11-15 16:43:39,FULL_DAY,Высшее образование (желательно техническое). Умение составлять сложные SQL запросы. Опыт практического применения в работе SQL запросов. Знание Python. ,Поддержка проверок внутреннего аудита в области выгрузки и обработки данных. Создание пользовательских витрин для типовых выгрузок. Ведение отчетности.,"Белая» заработная плата (выплаты 2 раза в месяц на банковскую карту). ДМС после прохождения испытательного срока. Официальное оформление, полное соблюдение...",
67697383,Junior Analyst / Младший аналитик данных,Go Ahead,,1,"Москва, Долгоруковская улица, 7",55.773793,37.603577,,,,,2022-11-09 11:01:03,2022-11-09 11:01:03,FULL_DAY,"Может в базовые формулы в Excel/Spreadsheets – уровня sum, vlookup; сводные таблицы. Имеет опыт написания и отладки SQL-запросов. ","Работать с базами данных. Взаимодействовать с разработчиками по улучшению качества сбора данных в БД. Работать с рекламными (Facebook, Google, Яндекс...","Проекты от крупнейших российских и международных брендов. Стабильную ЗП, комфортный диджитальный офис на Маяковской. Ежемесячные бонусы за выполнение KPI. ",
68148509,Младший аналитик данных,Федеральное государственное автономное учреждение Научно-исследовательский институт Центр экологической промышленной политики (ФГАУ НИИ ЦЭПП),,1,"Москва, Стремянный переулок, 38",55.727258,37.626807,,,,,2022-11-11 10:36:32,2022-11-11 10:36:32,FULL_DAY,"Опыт разработки отчетов в Power BI от 1 года, понимание схемы данных. Знание SQL на среднем уровне. Знание Excel и...","Работа с множеством источников данных: сбор, первичная обработка, изучение, анализ данных. Визуализация полученных результатов, создание схем, диаграмм, графиков, презентаций, используя...","Место работы: г. Москва, м. Серпуховская. График работы:5/2, 9.00-18.00. Оформление согласно ТК РФ с первого...",
69343784,"Аналитик данных, Управления экспертизы и фрод-мониторинга",Банк ВТБ (ПАО),,1,"Москва, Московское центральное кольцо, станция Деловой центр",55.747809,37.531963,,,,,2022-11-14 15:29:10,2022-11-15 16:17:28,FULL_DAY,"Опыт работы в области анализа данных от 3 лет, опыт работы с мобильными приложениями. Знание основных типов атак и схем...","Подготовка требований к доработке и разработке витрин данных, преобразованиям данных, проверкам качества данных. Работа с хранилищами данных (DWH). ","Трудоустройство согласно Законодательству. Конкурентная заработная плата. Профессиональное обучение и развитие. Добровольное медицинское страхование, льготные условия кредитования. Корпоративная пенсионная программа, материальная...",
72227204,Аналитик данных,ReleaseBand (Шумков Денис Александрович),,1,,,,1000.0,,USD,False,2022-11-11 11:58:39,2022-11-25 02:53:29,FULL_DAY,"опыт работы продуктовым аналитиком от 2х лет. - применять аналитические методы для представления решения. - понимать источники данных, их организацию и...","применять инструменты и методы анализа данных и визуализации данных (включая использование инструментов бизнес-информации). - выявлять, собирать и переносить данные в...","отсутствие бюрократии, открытость, быстрое принятие решений. - возможность переезда в Таиланд с привлекательным релокационным пакетом: (перелет, трансфер, проживание, питание, страховка, визы). - ",
72126930,Аналитик данных Управления исследований и бизнес аналитики,Банк Русский Стандарт,,1,"Москва, Ткацкая улица, 36",55.786187,37.73694,,,,,2022-11-09 11:13:46,2022-11-17 11:05:28,FULL_DAY,"Высшее математическое/техническое/экономическое образование. Опыт работы аналитиком от 1-го года. Продвинутый пользователь Excel: формулы, графики, сводные таблицы, желательно...",...данных бизнес подразделений. Подготовка аналитической отчетности для руководства по результатам выполнения региональных бизнес-планов. Мониторинг и актуализация внутренних источников данных.,"Официальное трудоустройство (соц.пакет, ДМС). Уровень заработной платы обсуждается индивидуально с успешными кандидатами. График работы: 5/2, 9:00-18:00...",
