vacancy_id,vacancy_name,company_name,address,latitude,longitude,salary_from,salary_to,salary_currency,salary_gross,publication_time,last_changed,schedule,req,resp,cond
72821966,Data Scientist (Middle),Газпромбанк,,,,,,,,2022-11-23 16:17:22,2022-11-24 17:46:56,FULL_DAY,"Профильное образование (техническое, компьютерные науки, статистика, математика). 3 года опыта профессиональной разработки моделей машинного обучения. Уверенное знание python. ","Взаимодействие с внутренними заказчиками (формулирование требований, подходов к исследованию/разработке модели и методов оценки конечного результата). Анализировать множество источников данных...",
72821352,Data Scientist (Senior),Газпромбанк,,,,,,,,2022-11-23 16:06:06,2022-11-24 17:44:21,FULL_DAY,"Профильное образование (техническое, компьютерные науки, статистика, математика). 5 лет опыта профессиональной разработки моделей машинного обучения. Уверенное знание python. ","Осуществлять управление разработкой новых и модификацией существующих моделей. Взаимодействие с внутренними заказчиками (формулирование требований, подходов к исследованию/разработке модели и...",
72820761,Data Scientist (Junior),Газпромбанк,,,,,,,,2022-11-23 15:50:12,2022-11-24 17:36:53,FULL_DAY,"Профильное образование (техническое, компьютерные науки, статистика, математика). 0-1 года опыта профессиональной разработки моделей машинного обучения. Уверенное знание python. ","Анализ различных источников данных, генерация признаков для построения модели. Разведочный анализ данных (EDA). Построение моделей машинного обучения. Внедрение моделей машинного...",
72752515,Менеджер по продажам образовательных программ международной школы Data Science и программи,Mathshub,,,,,,,,2022-11-25 13:21:02,2022-11-25 13:21:15,REMOTE,Умеете и любите продавать. Готовы к обучению. Имеете опыт продаж в сегменте b2c. Работали в CRM-системе. ,"Выпустить новые продукты профессий по направлениям разработки на русскоязычном рынке. Выстроить образовательную модель внутри команды, которая будет работать на масштабирование. ",Работу в коллективе с одним из самых сильных нетворков в сфере разработки и Data Science. Возможность профессионального роста. 
70243733,Data Scientist,Lamoda,"Москва, проспект Маршала Жукова, 1с1",55.775094,37.506523,,,,,2022-11-22 17:18:15,2022-11-27 07:01:17,FULL_DAY,"Опыт в области анализа данных и машинного обучения (от 2 лет). Опыт работы с SQL, Hadoop, Hive, Spark. ",У нас представлен полный жизненный цикл разработки data-driven продуктов с применением ML — от идеи и генерации гипотез до запуска...,"Официальное оформление, белую заработную плату. Гибкий график работы, есть возможность удобно планировать рабочее и личное время, а также работать удаленно. "
71712459,Senior Data Scientist ML/CV,Сбер для экспертов,,,,,,,,2022-11-24 09:38:11,2022-11-27 07:01:20,FULL_DAY,Аналогичный опыт работы от 3х лет. Образование: высшее техническое. Работа с данными (ex. как проверить корректность выбора тестового набора). ,Разрабатывать ML - математические модели в различных проектах Сбер. Участвовать в развертывании решений на промышленные системы Сбер и его клиентов.,"Ипотека выгоднее для каждого сотрудника и льготные условия кредитования. Бесплатная подписка СберПрайм+. Скидки на продукты компаний-партнеров: Okko, Сбер Маркет..."
54829296,Data scientist (Персонализация),"Компания «СПОРТМАСТЕР», Sportmaster Lab",,,,,,,,2022-11-23 11:07:05,2022-11-27 07:01:21,REMOTE,"Опыт использования и внедрения алгоритмов машинного обучения. Знание базовых алгоритмов и структур данных, понимание плюсов и минусов. Уверенное знание математической...",Использовать алгоритмы машинного обучения для решения бизнес-задач. Исследовать данные с целью получения новых признаков клиентов. Разрабатывать требования для сбора...,Возможность использовать выбранные инструменты для решения задач (у нас нет ограничений по стеку). Конкурентная заработная плата по результатам собеседования. 
72856413,Senior Data Scientist (Promo forecast),"МАГНИТ, Розничная сеть",,,,,,,,2022-11-24 07:44:13,2022-11-27 07:01:21,FULL_DAY,"Опыт лидирования команды из 3-4 человек, наставничество. Опыт работы с распределенными системами (HADOOP, Azure) посредством Spark. Опыт работы с...","Лидирование команды из 3-4 человек, проведение codereview, Unit тесты, постановка решений на бой. Прогнозирование спроса до уровня Торговая точка...","График работы 5/2 с гибким началом. Возможность работать в офисе в Москве и удаленно. Оформление по ТК РФ, оплачиваемые..."
72788567,Data Scientist middle+,Сбер для экспертов,,,,,,,,2022-11-23 08:15:46,2022-11-27 07:01:20,FULL_DAY,"Хорошие знания Python 3. Опыт работа с Pandas, SQL, Spark/PySpark, Hive и др. инструментами для анализа малых и больших...","Вам предстоит участвовать в развитии система форд-мониторинга Сбербанка, которая обеспечивает защиту клиентов банка во всех каналах обслуживания от мобильных...",
69865413,Senior/Tech Lead Data Scientist (Computer vision),WILDBERRIES,,,,,,,,2022-11-24 09:12:23,2022-11-25 17:16:56,FULL_DAY,"уверенное владение Python. - сильный SQL и умение самостоятельно отбирать необходимые данные. Будет плюсом: - опыт работы с Postgres, Vertica, ClickHouse. - ",Ротация между проектами.,"Предлагаем: Гибкое начало дня, удаленка или гибридный график. Сложные интересные проекты. Свободу в принятии решений. Профессиональный рост в команде увлеченных..."
72788226,Data Scientist – Senior/Chief,Сбер для экспертов,,,,,,,,2022-11-23 08:12:48,2022-11-27 07:01:20,FULL_DAY,"Успешные внедрения ML решений в бизнес-процессы и доведение их до прома, практический опыт их последующего мониторинга и развития. ","Вам предстоит участвовать в развитии система форд-мониторинга Сбербанка, которая обеспечивает защиту клиентов банка во всех каналах обслуживания от мобильных...",
71315683,Senior Data Scientist,Tele2,"Новомосковский административный округ, Киевское шоссе, 22-й километр, 6с1",55.633816,37.431936,,,,,2022-11-22 15:27:56,2022-11-22 15:27:56,FULL_DAY,"Высшее: математическое, IT, техническое. Дополнительное образование и курсы в области data science: Coursera, Udacity, CS229 и т.д.. ",Построение предсказательных моделей определения склонности к покупке существующих продуктов и услуг компании и партнеров. Построение моделей выбора наилучшего места для...,Интересная работа в быстроразвивающейся компании. Уникальная система обучения для каждого сотрудника на основе индивидуальных планов развития. Зеленый свет для новых...
68621600,Middle Data Scientist,Tele2,"Москва, Сокольническая линия, метро Румянцево",55.63292482088349,37.43951572485317,,,,,2022-11-22 15:27:50,2022-11-22 15:27:50,FULL_DAY,"Высшее образование: математическое, IT, техническое. Глубокое понимание алгоритмов машинного обучения и опыт их применения в работе. Знание математической статистики. ","Построение антифрод моделей (выявление спама, фрода, фишинга и пр.). Поиск аномалий для определения не стандартного поведения. Обработка корпусов текстов (семантический...",Интересная работа в быстроразвивающейся компании. Уникальная система обучения для каждого сотрудника на основе индивидуальных планов развития. Зеленый свет для новых...
69379894,Data Scientist / Специалист по работе с искусственным интеллектом,ГБУЗ «Научно-практический клинический центр диагностики и телемедицинских технологий ДЗМ»,"Москва, улица Петровка, 24",55.765027,37.617276,,,,,2022-11-24 12:04:28,2022-11-24 12:04:28,FULL_DAY,"Опыт работы frontend разработчиком (средний или базовый уровень). Опыт создания пользовательских интерфейсов. Высшее образование (предпочтительные направления - медицинская техника, медицинская кибернетика...",Проведение тестирований сервисов на основе технологий искусственного интеллекта (ИИ-Сервисов). Подготовка протоколов тестирования. Аналитика результатов работы ИИ-Сервисов. ,"Официальное трудоустройство. График 5/2 с 9.00 до 17.30, сб и вс выходные. Годовая премия, белая зарплата! "
72141335,Data Scientist,INFOWATCH,,,,,,,,2022-11-21 11:25:04,2022-11-22 10:00:30,FULL_DAY,Профильное повышение квалификации (курсы/специализации по data science) и/или опыт работы midle или senior data scientist от 1-2...,Обрабатывать большие массивы данных с использованием Big Data инструментов. Развивать DS-инфраструктуру подразделения. Развивать внутренний фреймворк для обработки и анализа...,Работа в аккредитованной ИТ-компании. Возможность удалённой работы на территории РФ. Гибкий график работы. Сплоченную команду. Ориентацию на результат. 
72547109,Data Science,Rutube,"Москва, Ленинградский проспект, 72к4",55.80525,37.519863,,,,,2022-11-21 09:27:01,2022-11-21 09:27:01,FULL_DAY,"Высшее образование в областях: математика, физика, информатика. Опыт работы с движками полнотекстового поиска. Понимание принципов работы современных ML алгоритмов. ","Полный цикл обучения ML моделей, включая подготовку данных для разметки и внедрение моделей в продакшн. Обучение моделей для ранжирования поисковой...",Опыт работы над крупнейшем видеосервисом страны. Работу в команде профессионалов и творческих людей. Достойный уровень дохода (обсуждается индивидуально с каждым...
72736422,Senior Data Scientist,Сбер. Data Science,,,,,,,,2022-11-22 09:32:49,2022-11-27 07:01:20,FULL_DAY,"Высшее образование в области компьютерных наук, статистики, прикладной математики или другой релевантной области. Глубокое понимание статистических подходов и методов (регрессия...","Предотвращение оттока. Оценка CLTV. Омниканальная рекомендательная система. Котирование кредитов и депозитов и т.д. Отраслевые модели. Классификация комментариев, обратной связи. ","Развитая IT архитектура. Комфортный офис, большой выбор вариантов по питанию, бесплатный фитнес в офисе. Скидки на продукты банка и экосистемы. "
72872678,Senior Data Scientist в медицинскую команду Sber AI Lab,Сбер для экспертов,,,,,,,,2022-11-24 11:23:57,2022-11-27 07:01:20,FULL_DAY,Знания и опыт в области Data Science (от 3 лет). Хорошее знание Python (в том числе опыт работы с Python...,Разработка новых наукоемких технологий. Взаимодействие с прикладными командами из бизнес подразделений по их внедрению. Анализ передовых научных работ. ,"Уникальные масштабные проекты, участие в международных конференциях. Возможность заниматься наукой, оставаясь в Москве. Дружный, высококвалифицированный коллектив с большим потенциалом роста. "
72800646,Senior Data Scientist (Time Series),Сбер для экспертов,,,,,,,,2022-11-23 10:45:21,2022-11-27 07:01:20,FULL_DAY,"Мы команда AI в SberНадежности, занимаемся детекцией аномалий и инцидентов по метрикам систем в Сбере. Плюсом будет опыт работы с...","Объем данных измеряется петабайтами. На текущий момент используем CatBoost для прогноза тренда, фильтр Калмана, экспериментируем с автоэнкодерами, с помощью FBProphet...",Ипотека выгоднее для каждого сотрудника и льготные условия кредитования. Бесплатная подписка СберПрайм+. Скидки на продукты компаний-партнеров. ДМС с первого...
72804111,Data Science Эксперт в Yandex Cloud,Яндекс,"Москва, улица Льва Толстого, 16",55.733771,37.587937,,,,,2022-11-23 11:36:31,2022-11-24 16:29:52,FULL_DAY,"...в области Data Science в одной из ролей: Настраивали инструменты DevOps, в том числе специфичные для сферы Data Science (Kubeflow...","Расширять аудиторию DataSphere. Исследовать рынок на предмет новых возможностей (продуктов, сценариев, регионов, индустрий, сегментов, пользователей) и доносить знания о трендах...",
71614417,Senior Data Scientist (WAF),Positive Technologies,"Москва, Преображенская площадь, 8",55.794887,37.712812,,,,,2022-11-22 13:28:40,2022-11-22 15:04:31,REMOTE,"Уверенное знание Python, git. Знание основных алгоритмов/методов машинного обучения. Владение библиотеками Pytorch, sklearn. Знание основных веб-технологий и протоколов. ",Проектирование математических моделей обнаружения атак на веб-приложения. Разработка и прототипирование статистических методов обнаружения аномалий в трафике. Поддержка и улучшение...,Можно работать удалённо или в офисе в минуте от метро Преображенская площадь (на 15 этаже с красивыми видами на Москву). 
70168410,Senior Data Scientist,Digital Reputation,"Москва, Калашный переулок, 12с2",55.756032,37.601052,,300000.0,RUR,False,2022-11-21 13:11:31,2022-11-25 10:52:28,FULL_DAY,Высшее техническое/математическое образование. Опыт построения и внедрения моделей машинного обучения и алгоритмов обработки данных в продакшн. Сильная теоретическая подготовка...,"Изучение материалов (научные статьи, книги, блоги и тд) по машинному обучению и computer science, тестирование и внедрение перспективных методов. ",Возможность формировать и вести команду data scientist с ростом портфеля продуктов. Атмосферу стартапа с высоким уровнем свободы и доверия. 
72725421,Middle Data Scientist (NLP),Сбер для экспертов,,,,,,,,2022-11-22 07:12:08,2022-11-27 07:01:20,FULL_DAY,"Опыт в части моделирования и обработки данных - не менее 1 года. Понимание не только того, как обучить модель на готовом...","Команда создает AI модели, направленные на сокращение t2m производства персонализированного контента для клиентов и на повышение эффективности этого...","Фиксированный оклад + годовой бонус. - ДМС, страхование от несчастных случаев, социальные гарантии. -Корпоративное обучение, курсы и тренинги. -Современный офис в..."
72679805,Lead Data Scientist,Сбер для экспертов,,,,,,,,2022-11-21 10:33:06,2022-11-27 07:01:20,FULL_DAY,"Высшее техническое/математическое/экономическое образование. Опыт работы на аналогичной позиции. Уверенные знания Python, Pyspark, SQL (Oracle, Postgres). Классификации/регрессии (Классический...","Управление командой 5-6 человек с разными компетенциями (Data Scientist, Инженеры, Разработчики) по Scrum. Создание AI продуктов и защита финансового...","Профессиональное обучение, семинары, тренинги, конференции. Годовые премии. ДМС, сниженные ставки по кредитованию, программы лояльности для сотрудников. Самые инновационные, амбициозные проекты..."
70345760,Аналитик / Data scientist,dentsu,"Москва, Пресненская набережная, 6 стр.2, Башня Империя",,,,,,,2022-11-21 07:49:49,2022-11-23 11:13:33,FULL_DAY,Знание основ мат. статистики и теории вероятности. Уверенное владение R или Python (pandas/numpy/sklearn). Желание самостоятельно исследовать данные и...,Разработка математических моделей оценки эффективности рекламы. Разработка предиктивных моделей на основе анализа больших массивов данных. Построение стратегических прогнозов и рекомендаций...,"Опыт реализации сложных data science проектов для крупных кампаний. Решение интересных нестандартных задач. Возможность понять, как работает современный бизнес и..."
72736408,Middle Data Scientist (Global Markets),Сбер. Data Science,,,,,,,,2022-11-22 09:32:21,2022-11-27 07:01:20,FULL_DAY,"MS SQL, Greenplum, PostgreSQL, InfluxDB. Grafana, Qlik Sense. Python ML/DL libraries, PySpark, PyTorch, TensorFlow. Теоретические знания. Математика. ",ДГР – предоставляет корпоративным и розничным клиентам широкий спектр продуктов и услуг на локальных и зарубежных финансовых рынках. Ключевые направления бизнеса...,"Машинное обучение. Комфортный офис по ул. Вавилова, 19. Скидки на продукты банка и экосистемы. Постоянное развитие: обучающие курсы от лучших..."
72229021,"Data Scientist, Товарные рекомендации",Ozon Информационные технологии,,,,,,,,2022-11-21 10:21:28,2022-11-27 07:01:20,REMOTE,Хорошее знание Python. Опыт работы с большей частью нашего стека технологий. Опыт решения production DS-задач в интернет-бизнесе (желателен...,"Создавать и улучшать алгоритмы рекомендаций товаров на сайте. ML-задачи от идеи до реализации в production: изучать статьи, заниматься поиском...","Динамичный и быстроразвивающийся бизнес, ресурсы, возможность сделать вместе лучший продукт на рынке e-commerce. Свободу действий в принятии решений. "
