vacancy_id,vacancy_name,company_name,company_dept,area,address,latitude,longitude,salary_from,salary_to,salary_currency,salary_gross,publication_time,last_changed,schedule,req,resp,cond,skills
70167434,Бизнес-аналитик (развитие процессов загрузки данных в БКИ),Тинькофф,,1,"Москва, Головинское шоссе, 5",55.84024,37.492024,,,,,2022-11-25 07:29:09,2022-11-25 07:29:09,FULL_DAY,"...с передачей данных в БКИ. Знание форматов и особенностей обмена данными с БКИ. Опыт работы с базами данных, знание SQL. ",...процессом сбора и отправки данных в БКИ. Организация процесса регулярной проверки качества выгружаемых в БКИ данных. Мониторинг своевременной и полной...,"Профессиональное развитие. Мы постоянно проводим митапы, тренинги и мастер-классы. В твоем распоряжении огромная библиотека с технической литературой. ",
72791375,Аналитик Данных (Data Analyst),Космос Про Медиа,,1,,,,,,,,2022-11-23 08:50:23,2022-11-25 21:29:57,FULL_DAY,"...большими массивами данных (обработка, анализ, проверка, верификация). Опыт выстраивания аналитики в продукте и конкретные кейсы, как эта аналитика помогла бизнесу.","Подготовка аналитических отчетов, разработка дашбордов по продуктовым метрикам. Сбор данных и поиск эффективных решений для проверки гипотез. Подготовка аналитических отчетов...",Высокая заработная плата. Возможность удаленной работы. Интересные международные проекты. Возможность подобрать удобный график работы. Возможности для быстрого профессионального и карьерного...,
72172721,Аналитик данных (Департамент оценки и методологии),АНО Россия – Страна Возможностей,,1,"Москва, 1-й Красногвардейский проезд, 21с1",55.750028,37.534397,,,,,2022-11-25 10:07:18,2022-11-25 10:20:36,FULL_DAY,"Умение применять аналитические модели при обработке большого массива данных. Навык построения алгоритмов, умение применять сложные формулы для обработки данных в...",Использовать статистические и математические методы для обработки данных по проектам и конкурсам АНО «Россия – страна возможностей». Прописывать алгоритмы обработки данных...,"Оформление по ТК РФ, ДМС. Офис Москва-Сити.",
70368551,Аналитик данных (клиентский опыт),Тинькофф,,1,"Москва, Головинское шоссе, 5",55.84024,37.492024,,,,,2022-11-22 10:28:30,2022-11-23 15:54:56,FULL_DAY,...в аналитике данных/продуктовой аналитике от года. Знание основ математической статистики и теории вероятности. Опыт в построении информативных визуализаций данных...,"Анализировать изменения (что, почему и как повлияло на клиентов). Искать и анализировать проблемы клиентов, находить точки роста. Выдвигать гипотезы, проводить...",Работу в офисе у метро «Водный стадион». График работы — гибридный. Профессиональное развитие. Вы получите доступ к библиотеке с технической литературой...,
72743750,Аналитик качества данных (дата стюард),"билайн: ИТ, Data, Digital","билайн: ИТ, Data, Digital",1,,,,,,,,2022-11-25 11:21:17,2022-11-25 11:21:45,FULL_DAY,"...работы аналитиком качества данных, дата саентистом от 2 лет или дата инженером от 1 года. Опыт работы с каталогом данных...","Поиск и анализ данных из разрозненных источников, инициализация процесса загрузки данных из новых источников, регулярный разбор конфликтов ( в данных ). ",,
72885814,Аналитик по качеству данных,"«МТС», IT","«МТС», IT",1,"Москва, проспект Андропова, 18к9",55.691684,37.66062,,,,,2022-11-24 14:50:37,2022-11-25 13:26:18,FULL_DAY,...данных не менее 3-х лет. Опыт внедрения процессов контроля качества данных. Опыт работы с автоматизированными инструментами контроля качества данных. ,Коммуницировать с заказчиками и потребителями данных для выяснения требований к качеству данных. Разрабатывать и внедрять процедуры контроля качества данных. ,"Медицинскую страховку с 1 месяца со 100% покрытием расходов, включая стоматологию, страхование жизни и здоровья в поездках за рубеж. ",
72756977,Менеджер-аналитик данных,Сбер. Data Science,Сбер. Data Science,1,,,,,,,,2022-11-22 14:37:19,2022-11-27 07:01:20,FULL_DAY,"Понимание предметной области и опыт работы по направлению. Хорошие навыки программирования (Python, SQL). Умение систематизировать данные и описывать полученную в...","Анализ расходов Блока Корпоративно-инвестиционного бизнеса и Функциональных Блоков, аллоцирующих расходы на Бизнес-Блоки. Подготовка аналитических материалов для тарификации расходов...","Современный Agile-офис, Кутузовский 32: парковка, спортзал, зоны отдыха, приятная атмосфера. ДМС с первого дня. Крупнейшее DS&AI community - более...",
70042203,Аналитик данных,ГБУЗ Центр Лекарственного Обеспечения Департамента Здравоохранения Города Москвы,,1,"Москва, 2-й Щемиловский переулок, 4Ас4",55.776178,37.60894,,,,,2022-11-23 07:12:31,2022-11-23 07:12:31,FULL_DAY,Высшее образование. Умение обрабатывать большие объемы данных и визуализировать результат. Умение идентифицировать аномалии в данных. Продвинутый пользователь Excel (сложные формулы...,"Обработка массива данных и подготовка информации для расчетов, автоматизация расчетов, работа с базами данных. Необходимость анализировать данные и вытаскивать неочевидные...","Работа в государственном учреждении. Место работы: м. Достоевская, м. Менделеевская, м. Новослободская, 2-й Щемиловский переулок, 4Ас4. ",
72816947,Аналитик данных (data science),Корпорация ЭЛАР,,1,"Москва, Бумажный проезд, 14с2",55.789902,37.586904,,,,,2022-11-23 14:30:47,2022-11-23 14:30:47,FULL_DAY,"Python 3.8+, SQL Alchemy, Redis, Numpy Pandas, опыт анализа данных, использования фреймворков машинного обучения, машинного зрения или OCR. ","Участие в постановке задач, подготовке ТЗ совместно с аналитиками. Участие в разработке интеллектуальных модулей совместно с разработчиками. Участие в разработке...","Участие в крупнейшем социально-значимом проекте. Отличный коллектив увлеченных сотрудников. Возможность совершенствоваться, развиваться профессионально, изучать новые технологии. Высокий уровень дохода. ",
72750012,Аналитик Данных / ALM,Газпромбанк,Газпромбанк,1,,,,,,,,2022-11-22 12:47:32,2022-11-22 20:24:15,REMOTE,"Опыт работы в роли аналитика данных не менее 3-х лет. Опыт работы с СУБД, умение составлять сложны SQL запросы. ","Описание и ведение глоссария в части данных, описание требований к витринам данных. Взаимодействие с владельцами данных других структурных подразделений банка...",Формат работы удаленный.,
72792299,Аналитик данных,СК Сбербанк страхование жизни,,1,,,,,,,,2022-11-23 09:03:43,2022-11-24 12:33:12,FULL_DAY,"Сильные навыки программирования на SQL в части аналитических запросов, профилирования и преобразования данных. Практический опыт работы с хранилищами данных. ",...контрольные семплы данных. Участвовать в разработке требований и написании SQL скриптов по загрузкам данных в хранилище и поставке данных пользователям. ,Стабильность и возможность участия в интересных проектах. Конкурентный доход и бонусы от личных результатов. Опытная команда менеджеров и плотное взаимодействие...,
71040857,Аналитик данных,Комус,,1,"Москва, проезд Завода Серп и Молот, 10",55.752587,37.702355,,,,,2022-11-22 14:53:34,2022-11-23 11:44:24,FULL_DAY,"Успешный практический опыт решения задач в области анализа данных, создания аналитических витрин, отчётов, автоматизации. Опыт работы со статистическими пакетами и...","...создание моделей данных, подбор метрик для оценки: Поддержка текущих отчётов (sql-запросы к хранилищу данных, репортинговые системы. Объединение данных из...","Работа в команде реальных профессионалов, практиков рынка, в динамичной и действительно успешной компании. Высокий ритм и быстрые решения. Широкие полномочия. ",
72673320,Аналитик данных,МигКредит,,1,,,,,,,,2022-11-23 12:23:32,2022-11-23 12:23:32,FULL_DAY,Владение SQL на уровне не ниже среднего. Понимание основных принципов и механик построения отчетности. Умение красиво и наглядно строить визуальные...,"Построение/поддержка отчетности в BI, Ad-hoc запросы от внешних и внутренних коллег, аналитика рисковых показателей и выявление зон роста.","Интересную работу в Fintech компании - лидере отрасли! Оформление по ТК РФ. Полностью белая ЗП. Нормированный рабочий день, у вас точно...",
72748002,Аналитик данных,Московский метрополитен,,1,,,,,,,,2022-11-22 12:17:53,2022-11-22 12:17:53,FULL_DAY,"...для анализа данных. Будет плюсом, если знаком с BI Visiology или другими BI системами. Понимал, как строятся хранилища данных. ",Улучшение текущих прогнозов в продуктах. Разработка новых аналитических продуктов. Ad-hoc аналитика на данных транспортного комплекса.,Офис в центре Москвы. Отпуск 42 календарных дня. График работы и финансовые условия обсуждаются индивидуально. Трудоустройство и работа в соответствии...,
71063549,Аналитик данных (ДТРРБ),"Иннотех, Группа компаний",,1,"Москва, Центральный административный округ, Пресненский район, Московский международный деловой центр Москва-Сити",55.749451,37.542824,,,,,2022-11-23 09:58:09,2022-11-23 09:58:09,FLEXIBLE,"Навыки сбора, обработки и анализа больших массивов данных из разных источников. Знание методов анализа данных, визуализации и презентации результатов. ","Применение методов анализа данных широкого спектра, построение моделей, фиксацию выводов и презентацию результатов. Развитие методологии отчетности, качества корпоративных данных и...",,
72728137,Аналитик данных в команду репутационной системы,АВИТО ТЕХ: поддержка и модерация,АВИТО ТЕХ: поддержка и модерация,1,"Москва, Лесная улица, 7",55.778669,37.587964,,,,,2022-11-22 07:43:57,2022-11-22 19:45:27,FULL_DAY,"применяли методы статистики и математики для решения прикладных задач. — любознательны, умеете презентовать результаты своих исследований и объяснять сложные вещи простыми...","взаимодействовать с другими командами для определения стратегии развития существующих продуктов. — получили высшее образование в области вычислительной математики, анализа данных, статистики...",В Авито сильная культура использования данных и удобная развитая инфраструктура для аналитиков. Для начинающих карьеру специалистов работа здесь — уникальный опыт...,
72759772,"Старший аналитик данных, Отдел продуктовой аналитики, Группа кросдоменной аналитики",Ozon Информационные технологии,Ozon Информационные технологии,1,"Москва, Пресненская набережная",55.746791,37.540991,,,,,2022-11-22 15:51:34,2022-11-27 07:01:20,REMOTE,...аналитике от 3х лет. Прекрасное знание Python. Владение SQL на высоком уровне. Наличие продуктового мышления или навыки продуктовой аналитики. ,"Плотное взаимдействия с командой разработки по предмет поиска данных и развития функционала, выкатывания новых фич. Управление бэклогом, формирование задач на...","Динамичный и быстроразвивающийся бизнес, ресурсы, возможность сделать вместе лучший продукт на рынке e-commerce. Свободу действий в принятии решений. ",
72745842,Аналитик данных,ФГБУ АГРОЭКСПОРТ,,1,,,,,,,,2022-11-22 11:51:31,2022-11-22 19:38:57,FULL_DAY,"Опыт работы в сфере поиска, сбора, обработки и анализа данных (BigData) не менее 1 года. Умение эффективно работать в режиме...","...баз данных (PostgreSQL, Hadoop) или аналогичных инструментов. Автоматизация сбора не типизированных данных, их подготовка и загрузка в базы данных. ",,
71020353,Аналитик данных/Data analyst,Благо Кредит,,1,,,,,,,,2022-11-23 06:58:47,2022-11-23 06:58:47,FULL_DAY,"Опыт построения моделей данных в Tabular и знание ключевых принципов. Моделирования данных. Знание DAX, M Code будет плюсом. ",...витрин данных и мониторинга их качества. Постановка задач по обогащению хранилища данных. Построение и администрирование моделей данных. Подготовка аналитики по...,"Работа в стабильной розничной федеральной сети. Официальное трудоустройство по ТК РФ. График работы обсуждается с кандидатом (офис, удаленная работа, гибридный...",
72727660,Аналитик данных в команду коммуникаций,АВИТО ТЕХ: аналитика,АВИТО ТЕХ: аналитика,1,"Москва, Лесная улица, 7",55.778669,37.587964,,,,,2022-11-22 07:38:26,2022-11-22 09:06:56,FULL_DAY,"строить дашборды в Redash. — математическая статистика и теория вероятности. — высокий уровень владения SQL, опыт написания витрин. — высокий уровень владения Python...","Наша команда развивает коммуникационные продукты Авито. Среди них есть коллтрекинг, который помогает бизнесам на Авито отслеживать звонки по объявлениям, и...","мощное железо, дополнительные мониторы и всё, что нужно для продуктивной работы. — личный бюджет на обучение, который можно тратить на книги...",
71574758,Аналитик данных в клиентском опыте,Ингосстрах,,1,"Москва, Пятницкая, 12 стр. 2",55.74339,37.627041,,,,,2022-11-22 06:14:02,2022-11-22 06:14:02,FULL_DAY,"Высшее образование (социологическое, маркетинговое, экономическое, финансовое, математическое, техническое). Обязательное знание статистических методов анализа данных: корреляционный анализ, факторный анализ, кластерный анализ...","Вывод таблиц данных с частотным распределением, базовыми статистическими показателями (значимости, средняя значения и т.п.). Текстовая аналитика. Статистический анализ данных. ",Работа в ТОП-10 страховых компаний РФ. Стабильная заработная плата. График 5/2 9:00-18:00. ДМС сразу после...,
70485345,"Аналитик данных, социальная коммерция",Ozon Информационные технологии,Ozon Информационные технологии,1,"Москва, Пресненская набережная",55.746791,37.540991,,,,,2022-11-21 15:12:54,2022-11-27 07:01:20,FULL_DAY,"Опыт работы аналитиком данных не менее двух лет. Опыт анализа данных, работы с хранилищем данных и поиска связей в данных. ",Выявлять возникающие у пользователей проблемы на основе данных и находить способы их решения. Изучать поведение пользователей на основе собранных данных...,"Динамичный и быстроразвивающийся бизнес, ресурсы, возможность сделать вместе лучший продукт на рынке social commerce. Свободу действий в принятии решений. ",
72678724,Аналитик по качеству данных ДАДМ,"Иннотех, Группа компаний",,1,,,,,,,,2022-11-21 10:20:14,2022-11-22 08:00:30,FULL_DAY,"Умение вести коммуникации с бизнес-заказчиками. Опыт участия в проектах по аналитике данных. Знания Phyton,PySpark, Hadoop. Опыт работы с...","...и модификации данных) , связанной с выявлением причин по возникновению ошибок качества данных. Выполнение регулярного мониторинга соответствия качества данных в IT...",,
71677969,Аналитик данных,Газпромбанк,Газпромбанк,1,,,,,,,,2022-11-22 12:40:28,2022-11-23 13:30:58,FULL_DAY,"Опыт работы от 3-х лет. Высшее образование. Экспертное знание Excel и его связки с MSSQL, SQL (Postrgess), MSSQL, Python. ",Автоматизация процессов выгрузки и загрузки данных и генерации отчетов. Администрирование ОЛАП-куба. Автоматизация обновления данных в презентациях и регулярных отчетах. ,,
71564767,Аналитик данных (Департамент продаж),Первый Дом Консалтинга ЧТО ДЕЛАТЬ КОНСАЛТ,,1,"Москва, Мишина улица, 56",55.798874,37.560413,,,,,2022-11-23 11:20:29,2022-11-23 12:14:35,FULL_DAY,"Знание языков программирования: консоль запросов 1С, знания в области структурированных запросов (SQL), обработки данных (OLAP и др). ","...голосовая аналитика), аналитика конкурентов. Выполнение работ по формированию, ведению и поддержке актуальной Базы Данных (БД). Осуществление сбора и подготовки данных...",Официальное трудоустройство по ТК РФ. График работы: 5/2. 9.00 - 18.00. Формат работы: гибрид. Обучение и развитие за...,
