vacancy_id,vacancy_name,company_name,company_dept,area,address,latitude,longitude,salary_from,salary_to,salary_currency,salary_gross,publication_time,last_changed,schedule,req,resp,cond,skills
71775706,Аналитик данных в команду Smart Money,АВИТО ТЕХ: аналитика,АВИТО ТЕХ: аналитика,1,,,,,,,,2022-10-31 12:09:18,2022-11-25 12:58:23,FULL_DAY,,"прогнозировать поведение пользователей. — участвовать во всех этапах продуктовой аналитики от логирования событий и создания метрик, до проведения исследований и поиска...","обучение за счёт компании: мы оплачиваем участие в российских и международных конференциях, а также предоставляем доступ к профильным курсам и...",
71731624,Аналитик данных,Сбер для экспертов,Сбер для экспертов,1,,,,,,,,2022-10-29 07:47:04,2022-11-27 07:56:05,FULL_DAY,"...аналитиком. Опыт работы с Jira/Confluence/BitBucket. Знакомство со Spark. Уверенное знание SQL. Знание основ Python, анализа и визуализации данных. ","Прогноз клиентов, собирающихся закрывать вклады. Установка индивидуальных курсов валют. Поиск и анализ данных во внутренних системах банка. Описание требований к...","Работа в очень хорошем офисе на Кутузовском. Возможен комбинированный график работы (офис, удаленно). Очень хорошая компенсация, годовые премии по результатам...",
72057080,Аналитик данных сервисов ИБ,NGENIX,,1,"Москва, Северный административный округ, улица 8 Марта, 1с12",55.80064,37.55531,,,,,2022-11-08 07:47:06,2022-11-08 10:33:54,FULL_DAY,2+ года в роли аналитика данных. Владеешь статистическими методами анализа потоковых данных. Имеешь опыт работы с большими массивами данных...,"...массивы данных на предмет наличия в пользовательских запросах к веб-приложениям признаков вредоносного нелегитимного трафика (DDoS-атаки, парсинг данных, подбор...","Надежная аккредитованная IT компания, которая постоянно развивается и растет в среднем на 30% каждый год. Конкурентоспособная «белая» зарплата, прозрачная система...",
69899632,Аналитик качества данных [id9864],ПАО «Газпром нефть»,ПАО «Газпром нефть»,1,,,,,,,,2022-10-31 11:43:34,2022-11-25 11:57:26,FULL_DAY,...качества данных в роли аналитика или архитектора. Получил опыт использования инструментов профилирoвания и монитoринга качества данных; опыт анализа источников данных. ,"...источников данных с Корпоративным хранилищем данных (КХД) в части способа интеграции и информации о структуре данных, категории конфиденциальности данных. ","Рабoту в стабильнoй, динамично развивающейся компании. Перспективу прoфессиoнального рoста. Гoдoвой бoнус. Кoнкурентную зарплату. Профессиональное обучение. Удаленный формат работы. ",
71882774,Аналитик баз данных (JDA),METRO Cash & Carry,,1,"Москва, Ленинградское шоссе, 71Г",55.875753,37.447279,,,,,2022-11-02 13:24:02,2022-11-17 08:59:53,FULL_DAY,"Умение работать с большими объемами информации, выгрузками данных. Опыт работы с базами данных, умение писать сложные запросы на PL\SQL...",Полная поддержка система JDA (Demand и Fulfillment модули) со стороны бизнеса в качестве ключевого пользователя системы. Разработка и согласование технических...,Возможность профессионального и карьерного роста в международной компании. Возможность приобрести опыт работы с коллегами из других стран. Комфортабельные условия работы...,
71236171,Аналитик данных (финансовое направление),СИСТЭМ ЭЛЕКТРИК,,1,"Москва, улица Двинцев, 12к1",55.796223,37.59984,,,,,2022-11-02 13:28:45,2022-11-21 14:09:30,FULL_DAY,Высшее оконченное математическое/финансовое образование. Опыт работы с анализом и визуализацией данных в финансовой сфере. Продвинутое владение BI инструментами (Excel...,Обработка и проверка больших массивов первичных данных. Контроль качества данных. Участие в проекте по разработке корпоративного хранилища данных.,Оформление в соответствии с ТК РФ (по договору аутсорсинга). Конкурентоспособное вознаграждение. ДМС (со стоматологией). Гибридный формат работы (1-2 дня...,
71879054,Веб-аналитик/аналитик данных,Инвестиционная компания Фридом Финанс,,1,,,,,,,,2022-11-02 12:20:28,2022-11-25 11:01:08,FULL_DAY,"Опыт работы в области хранилищ данных, BI-систем или больших данных. Опыт построения сквозной аналитики. Знания основ моделирования баз данных. ","Делать аналитику клиентской базы, анализировать процессы жизненного цикла клиента, готовить отчеты. Настраивать Post-view аналитику, data – driven моделей атрибуции. ","Возможности для самореализации, профессионального и карьерного роста​. Достойную оплату труда + компенсационные, стимулирующие и мотивационные выплаты​. Система корпоративных скидок на...",
72009804,Аналитик данных по пассивам физических лиц,Сбер для экспертов,Сбер для экспертов,1,,,,,,,,2022-11-07 09:04:09,2022-11-27 07:01:20,FULL_DAY,"Составление описаний процессов. Опыт работы с SQL для анализа данных, умение составлять простые запросы. Умение описывать структуру данных и связи.","Участие в разработке новых пассивных продуктов для клиентов РВ, согласование с различными подразделениями банка технологических доработок для запуска данных продуктов...","Работа в крупнейшем банке России. Трудоустройство согласно ТК РФ. Регулярное корпоративное обучение. ДМС, страхование от несчастных случаев и тяжелых заболеваний. ",
71881834,Аналитик данных / Категорийный менеджер / Маркетплейсы,Текс-Дизайн,,1,"Москва, Складочная улица, 1с15",55.798611,37.594387,80000.0,,RUR,False,2022-11-02 13:07:51,2022-11-20 13:00:16,FULL_DAY,Опыт работы в текстиле для дома от 2-х лет или смежных отраслях. Опыт и обработка данных из разных источников...,"Ценообразование на основе плановых показателей (маржи, наценка, плановая скидка, операционные расходы), рынка и аналитических данных прошлых периодов. Расчет коллекции в...",Заработная плата от 80 000 руб.,
67560361,Руководитель центра аналитики данных,Страховая компания Пульс,,1,"Москва, Кожевническая улица, 14с2",55.728981,37.646256,,,,,2022-11-25 06:25:17,2022-11-25 06:25:17,FULL_DAY,...внутренними и внешними источниками данных. Опыт внедрения и использования инструментов для нормализации и обеспечения качества данных. Опыт внедрения BI и...,"Задачами команды являются построение инфраструктуры сбора, нормализации, обогащения и анализа данных, поиск инсайтов и полный цикл разработки/внедрения предиктивных моделей...","Профессиональное развитие в команде экспертов, нетривиальные задачи, новый интересный опыт. Возможность работать удаленно и в офисе, гибкое начало рабочего дня. ",
67497281,Системный аналитик на направление Хранилище данных (DHW),Клевертек,,1,,,,,,,,2022-11-26 11:44:11,2022-11-27 11:56:12,FULL_DAY,"Опыт работы в качестве аналитика с хранилищами данных (DWH), понимание архитектуры хранилищ. Понимание концепций построения DWH и ETL. ","...ИТ-системах Банка. Разработка функциональных спецификаций с учетом архитектуры хранилищ данных. Участие в проектировании и разработке решений (DWH, ETL, отчеты).",Удалённый формат работы. Проекты для топовых компаний. Конкурентную ЗП. Корпоративный английский язык. Возможность обучения и посещения конференций за счет компании. ,
69798669,Маркетолог-аналитик базы данных CRM,Stormoff®,,1,,,,,,,,2022-11-25 13:06:26,2022-11-25 13:06:27,FULL_DAY,"...сквозной аналитики. Навыки работы с Microsoft Excel (сводные таблицы). Навыки анализа юридических лиц (Сбис, Спарк, Контур и др.). Опыт аналитики...","Регулярный анализ базы данных CRM: лиды, запросы и сделки, конверсия на каждом этапе воронки, причины изменения показателей (рост, падение, всплески...",Развитие и карьерный рост в команде профессионалов. Интересные задачи в одной из самых узнаваемых торгово-производственных организаций на рынке медицинского...,
71757465,Системный аналитик (Scrum-master/PM) в области разработки систем хранения данных и аналитики,Апптимизм,,1,,,,150000.0,,RUR,False,2022-11-27 07:27:36,2022-11-27 08:19:38,FULL_DAY,"находить и “драйвить” методы эффективного управления product backlog. - опыт работы Scrum-мастером/PMом от 2 лет, опыт работы в сфере...",работа в IT-проектах со сложным ландшафтом (от 2 лет). - очень желательна экспертиза в аналитике/разработке/тестировании или другой фазе...,,
71491903,Старший аналитик Отдел развития хранилищ данных,НКО Национальный Клиринговый Центр (АО),,1,"Москва, Спартаковская улица, 12",55.772051,37.675127,,,,,2022-11-24 07:01:08,2022-11-24 07:01:08,FULL_DAY,"Опыт работы в Банках на позиции аналитик, разработчик от 3-х лет. Опыт применения языка PL/SQL, Oracle. ","...и анализ качества данных. Взаимодействие с разработчиками БД по вопросам качества данных. Исследование систем-источников, структур и интеграционных слоев данных.","Возможность работать удаленно. График работы с 9:00 до 18:00, в пятницу с 9:00 до 16:45. ",
72462241,Senior Data Scientist / Аналитик данных,Netex24,,1,"Москва, Замоскворецкая линия, метро Динамо",55.789704,37.558212,,250000.0,RUR,False,2022-11-17 09:07:24,2022-11-24 13:00:55,FULL_DAY,"Опыт применения широкого спектра алгоритмов для решения поставленных задач, которого будет достаточно для большинства проектов, связанных с интеллектуальной обработкой данных. ","...товаров и услуг, подбор целевой аудитории, банковский скоринг. Моделирование сложных финансовых, технических и социальных систем, анализ данных, оптимизация и планирование.",Коворкинг А-класса в Москве на м. Динамо (удалённый формат работы по данной позиции не рассматривается). Варианты трудоустройства (на Ваш...,
72481614,"Руководитель направления Аналитика, процессы и качество данных",Банк ДОМ.РФ,,1,"Москва, улица Воздвиженка, 10",55.753301,37.606263,,,,,2022-11-22 06:30:49,2022-11-22 06:30:49,FULL_DAY,"Опыт работы в банках, финтех, рисках, ИТ на позиции bi-аналитика, аналитика данных или инженера данных. Приветствуется опыт в программировании. ",Постановка задач на ИТ на доработку отчетов и витрин данных. Согласование и разработка методологий расчета бизнес метрик. Разработка совместно с...,Конкурентный уровень заработной платы + премии по итогам работы за год в соответствии с утвержденными внутренними политиками. Сокращенный рабочий день...,
71550052,"Системный аналитик (хранилище данных, DWH)",МТС Банк. IT,МТС Банк. IT,1,,,,,,,,2022-11-23 10:59:09,2022-11-23 10:59:09,FULL_DAY,Опыт работы на проектах хранилища данных в качестве системного аналитика. Понимание архитектуры и принципов работы хранилищ данных и аналитических систем. ,"...хранилища данных. Выработка системных решений для обеспечения полноты, доступности и качества необходимых данных. Документирование, систематизация и унификация витрин данных и...",Работа в современной надежной цифровой компании. Достойная заработная плата. Комфортный и стильный офис в двух минутах от м. Технопарк. ,
72017561,Аналитик данных (оценка активов и залогов),Центральный банк Российской Федерации,,1,"Москва, улица Правды, 6с1",55.784668,37.578603,,,,,2022-11-07 10:38:18,2022-11-25 13:49:20,FULL_DAY,"Профильный опыт работы от 3 лет. Необходимые теоретические знания: Основы построения баз данных, SQL, Python, желательно понимание процесса кредитования под...","Выгрузка данных с применением SQL запросов, подготовка и визуализация аналитических данных. Автоматизация регулярной отчетности, анализ, поиск причинно-следственных связей (отклонений). ",Получение уникального опыта в мегарегуляторе. Возможности профессионального и карьерного развития. Привлекательная система мотивации. Широкий социальный пакет. Корпоративное обучение. ,
71186604,Бизнес-аналитик проектной деятельности и качества данных (Финансовый Департамент),Банк ВТБ (ПАО),,1,"Москва, Пресненская набережная, 12",55.749395,37.536967,,,,,2022-11-16 18:22:08,2022-11-16 18:22:08,FULL_DAY,...бизнес-аналитика на проектах по хранилищам данных в финансовых организациях. Знание принципов построения и типовой базовой архитектуры хранилищ данных. ,...качества данных на хранилищах данных. Сбор и подготовка требований к тестированию периметра Управления отчетности и финансовых данных на хранилищах данных. ,"Трудоустройство согласно Законодательству. Конкурентная заработная плата. Профессиональное обучение и развитие. Добровольное медицинское страхование, льготные условия кредитования. Корпоративная пенсионная программа, материальная...",
70159029,Бизнес/системный аналитик данных по интеграции,Ригла,,1,,,,,,,,2022-10-31 09:42:03,2022-11-25 09:58:02,FULL_DAY,"Высшее техническое образование. Знание интерфейсов межсистемного взаимодействия. Теория баз данных, SQL. Владение CASE-средствами анализа и проектирования (предпочтение uml/aris...","Развивать собственные продукты и интегрировать стороннее ПО в информационную инфраструктуру компании. Собирать, анализировать и формализировать требования бизнес-подразделений. ","Интересные масштабные проекты по развитию собственных продуктов и интеграцией стороннего ПО в информационную структуру компании (например, лояльность и CRM, внедрение...",
69761930,Data Analyst/ Руководитель направления анализа данных,Банк СОЮЗ (АО),,1,"Москва, Сущёвская улица, 27с1",55.78320970482742,37.60106001471469,,,,,2022-11-07 06:31:10,2022-11-07 06:31:10,FULL_DAY,"Высшее экономическое, финансовое, техническое образование, физико-математическое, военно-инженерное. Минимальный стаж в банке от 3 лет в области DA и...",Разработка и наполнение витрин данных. Формирование и формулирование принципов аналитической отчетности. Построение BI аналитики в Банке. Формирование BI аналитики реализуемых...,"Официальное трудоустройство и соблюдение норм ТК РФ. График работы 5\2 с 9:00 до 18:00, пятница сокращенный день...",
71324989,Системный аналитик (хранилище данных),Банк Русский Стандарт,,1,"Москва, Ткацкая улица, 36",55.786187,37.73694,,,,,2022-11-09 10:22:33,2022-11-17 11:05:28,FULL_DAY,...и/или компаниях интеграторах на позиции аналитика/ технолога. Знание архитектуры и принципов работы хранилищ данных и аналитических систем на их...,Описание переноса бизнес-логики на ИТ-процедуры. Разработка маппингов и алгоритмов обработки данных для загрузки в хранилище Neoflex Reporting (на...,"Достойный уровень оплаты труда, обсуждается индивидуально по итогам собеседования с руководителем. ДМС. График работы: 5/2. Возможен гибридный формат работы. ",
72136579,Системный аналитик хранилищ данных,РСХБ-Интех,,1,"Москва, Профсоюзная улица, 125А",55.62331,37.511032,,,,,2022-11-09 13:39:43,2022-11-18 09:10:34,FULL_DAY,"...Управленческая отчетность, Розница, Корпоративный бизнес, Риски, Казначейство, Финансовый мониторинг, СВА. Опыт работы с хранилищами в роли аналитика, знание банковской сферы.",Написание ТЗ и спецификации разработчикам на основе требований бизнес-пользователя. Работа с командой и постановка задач разработчику. Формирование плана проекта. ,"Амбициозные, интересные задачи с возможностью проявить себя, возможность профессионального развития и карьерного роста. Работа в сплочённом коллективе единомышленников. ",
72293408,Media Insights analyst / Специалист по анализу данных о потребителе в медиа,Unilever,,1,,,,,,,,2022-11-14 08:27:02,2022-11-26 13:01:12,FULL_DAY,Experience in an analytical role and providing insight and recommendation based on analysis. Experience of using such analytical tools as...,Work closely with the People Data Center Insights Manager to translate internal briefs into analytical projects. Conduct analysis using in...,,
